<?xml version="1.0" encoding="UTF-8"?>


<students
    xmlns:xsi="http://www.w3.org/2001/XMLSchema-instance"
    xsi:noNamespaceSchemaLocation="student.xsd">

    <student>
        <name>Ali</name>
        <age>18</age>
        <marks>95</marks>
    </student>
    <student>
        <name>Ahmed</name>
        <age>21</age>
        <marks>85</marks>
    </student>
</students>